{
  "$schema": "http://json-schema.org/draft-07/schema#",
  "title": "Wurzelschema",
  "description": "Dies ist das Wurzelschema, das die Schemas f√ºr die einzlenen Felder referenziert.",
  "type": "object",
  "required": ["@context", "gndIdentifier", "id", "preferredName", "type"],
  "properties": {
    "@context": {
      "$ref": "context-schema.json"
    },
    "id": {
      "$ref": "id.json"
    },
    "gndIdentifier": {
      "$ref": "gndIdentifier.json"
    },
    "type": {
      "$ref": "type.json"
    },
    "preferredName": {
      "$ref": "preferredName.json"
    },
    "variantName": {
      "$ref": "variantName.json"
    },
    "contributor": {
      "$ref": "professionOrOccupation.json"
    },
    "professionOrOccupation": {
      "$ref": "professionOrOccupation.json"
    },
    "gender": {
      "$ref": "gender.json"
    },
    "geographicAreaCode": {
      "$ref": "geographicAreaCode.json"
    }
  }
}